sansan_organization_code,url,country_code,corporate_number,name,name_furigana,address_inside,prefecture_name,prefecture_code,updated_at
1541073218435,http://www.city.tamba.lg.jp,JP,3000020282235,丹波市,タンバシ,兵庫県丹波市氷上町成松字甲賀1,兵庫県,28,2023-04-03T11:03:55Z
9412307176995,,JP,8430001010583,ツカサ薬品株式会社,ツカサヤクヒン,北海道札幌市北区北三十一条西5丁目1番30号,北海道,01,
7008603878624,http://maccs-co.com,JP,5430001041581,株式会社マックス,マックス,北海道札幌市北区北十四条西2丁目1番5号,北海道,01,
5714150437544,https://act-pharmacy.jp/,JP,9430001027271,株式会社アクト調剤,アクトチョウザイ,北海道札幌市中央区南一条西11丁目327番地6ワンズ南一条ビル3階,北海道,01,
8848028667281,http://www.nihon-chemical.co.jp/index.html,JP,4430001024158,株式会社日本ケミカル,ニホンケミカル,北海道札幌市中央区南七条西15丁目1番1号,北海道,01,
5359462907848,http://www.central-eye-clinic.jp,JP,2430005012235,医療法人社団SCM,エスシーエム,北海道札幌市北区新川三条7丁目1番64号,北海道,01,
9765478679916,http://www.kiyomizuk-c.or.jp/greeting/,JP,2430005003993,医療法人社団きよみず公園クリニック,キヨミズコウエンクリニック,北海道札幌市白石区東札幌四条3丁目6番1号,北海道,01,
6186396906205,http://www.takuma-family.com/,JP,1460105000385,医療法人社団北馬会たくまファミリー歯科,ホクバカイタクマファミリーシカ,北海道札幌市北区北二十五条西4丁目2番5号マックスバリュ北店2F,北海道,01,
2267517558631,,JP,9430005001776,医療法人社団しのろ眼科医院,シノロガンカイイン,北海道札幌市北区篠路二条4丁目5番11号メディコアしのろ1階,北海道,01,
9917028953909,,JP,6430005013510,医療法人社団悠美会,ユウビカイ,北海道札幌市白石区南郷通14丁目北3番20号,北海道,01,
8639285794262,,JP,6430005013493,医療法人社団リーサ矯正歯科,リーサキョウセイシカ,北海道札幌市白石区南郷通14丁目北1番4号ニューフロンティアビル1F,北海道,01,2023-04-03T04:59:58Z
5425052250182,http://www.town.ino.kochi.jp,JP,9000020393860,いの町,イノチヨウ,高知県吾川郡いの町1700-1,高知県,39,
7832306856482,,JP,,,,,,,
3622795466204,http://www.bsg.cc,JP,8430001039466,株式会社メディカル・エイド北海道,メディカル・エイドホッカイドウ,北海道札幌市白石区栄通15丁目9番34,北海道,01,
5582249314789,http://www.heiikukai.com/,JP,9010405009255,医療法人社団平郁会,ヘイイクカイ,東京都中央区日本橋馬喰町1丁目5番4号,東京都,13,
9664137369910,https://www.daiwa6203.com/,JP,2330001014261,株式会社大環,ダイワ,熊本県八代市袋町1番45号いずみビル2階,熊本県,43,
3887959014591,,JP,,,,,,,
1551567920675,http://www.otsubo-dental.com,JP,4430005003315,医療法人社団弘智会おおつぼ歯科クリニック,シャダンヒロシトモエオオツボシカクリニック,北海道札幌市白石区菊水上町一条2丁目100番50,北海道,01,
6824221068961,http://www.kumasan-hc.com/,JP,6430005013072,医療法人社団ありがとうの風在宅療養支援診療所くまさんクリニック,アリガトウノカゼザイタクリョウヨウシエンシンリョウジョクマサンクリニック,北海道札幌市白石区北郷二条12丁目4番14号,北海道,01,
5785389357522,http://www.ohtsuka-eye.com/,JP,9430005001792,社会医療法人秀眸会大塚眼科病院,シュウホウカイオオツカガンカビョウイン,北海道札幌市北区北十六条西4丁目2番17号,北海道,01,
6943528497228,http://www.kotoni-tower.jp,JP,9430005001867,医療法人社団天祐会,テンユウカイ,北海道札幌市北区新琴似八条13丁目2番9号,北海道,01,2023-04-03T03:26:44Z
6205764788504,,JP,7430001062295,株式会社エフアンドエス,エフアンドエス,北海道札幌市白石区本郷通5丁目南3番7-901号,北海道,01,2023-04-03T06:57:23Z
9628429826183,http://www.kyoueikai.or.jp/,JP,6430005001795,社会医療法人共栄会,キョウエイカイ,北海道札幌市白石区川下577番地8,北海道,01,
1646204604653,http://miraikai.or.jp,JP,8430005012923,医療法人社団みらい会,ミライカイ,北海道小樽市若松1丁目9番10号,北海道,01,
6455693973674,https://asabu-heart.com/,JP,6430005014129,医療法人新楓和会,シンフウワカイ,北海道札幌市北区北四十条西4丁目1番1号ASABULAND1階,北海道,01,
6619320050138,http://www.mimatu.or.jp,JP,5430005000609,社会福祉法人美松善隣会,ミマツゼンリンカイ,北海道札幌市白石区本通16丁目北4番30号,北海道,01,
7707301242135,,JP,6430005001738,医療法人社団杉山歯科医院,スギヤマシカイイン,北海道札幌市北区新琴似七条6丁目5番21号,北海道,01,
9857887074404,http://www.town.hokkaido-mori.lg.jp,JP,6000020013455,森町,モリマチ,北海道茅部郡森町字御幸町144-1,北海道,01,2023-04-03T04:15:04Z
9063728847146,,JP,2000020261009,京都市,キヨウトシ,京都府京都市中京区寺町通御池上る上本能寺前町488,京都府,26,2023-04-03T11:03:54Z
5839529798942,http://ritsueikai.com,JP,1430005003284,医療法人社団律英会,シャダンリツエイカイ,北海道札幌市北区北二十四条西4丁目1-6鈴木ビル2F,北海道,01,2023-04-03T03:35:00Z
9943579928068,,JP,,,,,,,
5574216522185,http://www.kyoseiweb.com,JP,5430005004535,医療法人社団よこやま矯正歯科,ヨコヤマキョウセイシカ,北海道札幌市北区麻生町4丁目12番8号アルファ麻生ビル7階,北海道,01,
6986457397714,,JP,7430005004079,医療法人社団旺仁会,シャダンオウジンカイ,北海道札幌市白石区南郷通14丁目南3番11号,北海道,01,
1019711645210,,JP,8180005005325,医療法人健進会,ケンシンカイ,愛知県名古屋市緑区浦里2丁目174番地,愛知県,23,
6089665021889,,JP,6430005001548,医療法人社団大屋医院,オオヤイイン,北海道札幌市白石区川下二条7丁目2番5号,北海道,01,2023-04-03T03:35:05Z
9720046639523,,JP,6430005010516,医療法人平和の森耳鼻咽喉科クリニック,ヘイワノモリジビインコウカクリニック,北海道札幌市白石区平和通5丁目北11番20号,北海道,01,
2362312591509,,JP,7120001187009,株式会社Trees,ツリーズ,兵庫県芦屋市船戸町3番24-206号,兵庫県,28,
7816286784310,,JP,8430005001554,医療法人社団及川皮膚科医院,シャダンオイカワヒフカイイン,北海道札幌市北区北四十条西4丁目325番地8麻生メディカルビル3階,北海道,01,
4910815162879,https://www.miwadental.jp/,JP,5430005013486,医療法人東札幌三輪デンタルクリニック,ヒガシサッポロミワデンタルクリニック,北海道札幌市白石区東札幌三条1丁目1番1号ラソラ札幌Bタウン2F,北海道,01,2023-04-03T15:49:34Z
7566868519775,http://www.hokujinkai.org/,JP,3430005002020,社会医療法人北腎会,ホクジンカイ,北海道札幌市西区八軒二条西4丁目1番1号,北海道,01,
3050252622956,https://www.kraft-net.co.jp/company/about/kraft/,JP,8010001129202,クラフト株式会社,クラフト,東京都千代田区丸の内1丁目1番1号,東京都,13,
6709525684799,https://haisha-yoyaku.jp/bun2sdental/detail/index/id/0130233851/,JP,6430005001746,医療法人社団清水歯科クリニック,シャダンシミズシカクリニック,北海道札幌市北区新琴似八条2丁目1番13号,北海道,01,
8551122887773,http://www.kin-ikyo-shika.jp/,JP,4430005004453,医療法人北海道勤労者歯科医療協会,ホッカイドウキンロウシャシカイリョウキョウカイ,北海道札幌市西区発寒六条9丁目2番6号,北海道,01,
9809550372953,,JP,6430005014137,医療法人社団あいさに,アイサニ,北海道札幌市北区北二十五条西5丁目1番3号,北海道,01,
7224404823509,,JP,8430005001612,医療法人社団いけだクリニック,イケダクリニック,北海道札幌市北区あいの里二条8丁目4番5号,北海道,01,
3966164092218,http://www.naga-reha.or.jp/,JP,4080105001808,医療法人社団一就会,イッシュウカイ,静岡県伊豆の国市長岡946番地,静岡県,22,
7070807239940,http://www.n-i-c.co.jp/,JP,2290001019694,株式会社ニック,ニック,福岡県福岡市博多区山王1丁目12番19号,福岡県,40,
8689504597919,,JP,,,,,,,
9147015987584,,JP,4320001013163,株式会社Care-Labo,Care-Labo,大分県大分市横塚1丁目311番,大分県,44,
2428638290523,http://www.ahcdyc.com,JP,,,,,,,
8100171959897,http://www.lifepartner.or.jp/,JP,2430005012383,医療法人社団ライフパートナー,ライフパートナー,北海道札幌市北区北十三条西3丁目2番1号アルファスクエア北13条2階-F号室,北海道,01,
7897711596100,http://www.2-a.co.jp,JP,4430002032110,有限会社ツーエイ,ツーエイ,北海道札幌市中央区南一条西27丁目1番41号,北海道,01,
4679598692504,,JP,7340001013407,株式会社信美,シンビ,鹿児島県霧島市国分福島1丁目23番40号,鹿児島県,46,
1503255697722,https://www.j-medix.com/,JP,9430001007117,ジェイ・メディックス株式会社,ジェイメディックス,北海道札幌市北区北二十四条西14丁目3番5号,北海道,01,2023-04-03T03:26:42Z
7088761756796,http://musubitome.com,JP,7190001028882,株式会社結び,ムスビ,三重県四日市市日永西5丁目6-1,三重県,24,
9037323139576,,JP,4430005001665,医療法人社団小谷内科医院,シャダンコヤウチカイイン,北海道札幌市北区北二十三条西4丁目19番地478,北海道,01,
5454337238682,http://www.syuei.com,JP,8430005001802,医療法人社団秀英会,シャダンシュウエイカイ,北海道札幌市北区新琴似八条9丁目2番1号,北海道,01,
8680458079408,,JP,6430005003742,医療法人社団おおやち耳鼻咽喉科クリニック,シャダンオオヤチジビインコウカクリニック,北海道札幌市厚別区大谷地東2丁目3番35号,北海道,01,
9280386547303,http://lilas-clinic.jp,JP,4430005010674,医療法人社団リラ整形外科クリニック,リラセイケイゲカクリニック,北海道札幌市北区屯田九条3丁目1番20号屯田メディカルモール1階,北海道,01,
2810250700852,,JP,5430005001697,医療法人社団クローバー歯科,クローバーシカ,北海道札幌市北区北二十五条西5丁目1番18号,北海道,01,2023-04-03T03:34:57Z
2135846273133,,JP,3430005013752,医療法人暖和会,ダンワカイ,北海道札幌市北区新川五条1丁目1番1号,北海道,01,
1260507930005,http://www.wagaya-miyada.com/,JP,7100002034590,有限会社わが家,ワガヤ,長野県上伊那郡宮田村7577番地5,長野県,20,
7766422457944,,JP,6350005005375,特定非営利活動法人一夢庵,イチムアン,宮崎県日向市比良町4丁目85番地,宮崎県,45,
1491358272121,http://www.hirom-p.com,JP,9430002039217,株式会社ヒロム,ヒロム,北海道札幌市中央区南十五条西19丁目1番13号,北海道,01,
3012935685979,http://www.ono-ganka.or.jp/,JP,4430005001574,医療法人社団小野眼科医院,オノガンカイイン,北海道札幌市北区新琴似八条11丁目2番7号,北海道,01,
2153818345278,http://www.goryokai.com,JP,9430005001719,医療法人社団五稜会病院,シャダンゴリョウカイビョウイン,北海道札幌市北区篠路九条6丁目2番3号,北海道,01,
9638677833012,http://www.daisyo.co.jp,JP,,,,,,,
3921829537372,,JP,3060005003956,特定非営利活動法人ひなた,ヒナタ,栃木県那須塩原市東小屋462番地6,栃木県,09,
5764085886553,https://kokoro34.co.jp/#top,JP,9011001066574,株式会社志,ココロザシ,東京都新宿区西五軒町8-10臼井ビル2階,東京都,13,
8836049424138,https://sapporo-spine.com/,JP,6430005012917,医療法人さっぽろ脊椎外科クリニック,サッポロセキツイゲカクリニック,北海道札幌市北区北十三条西2丁目2番1号,北海道,01,
2966629495563,http://www.doinaika-clinic.jp,JP,3430005011715,医療法人社団どい内科クリニック,ドイナイカクリニック,北海道札幌市北区新琴似一条3丁目3番13号,北海道,01,2023-04-03T10:20:43Z
5424831796569,http://kotohp.or.jp,JP,9430005002015,医療法人社団豊武会,シャダントヨタケカイ,北海道札幌市白石区本郷通7丁目南4番30号,北海道,01,
6016615793717,http://shinsankenkai.or.jp,JP,7430005004533,医療法人新産健会,シンサンケンカイ,北海道札幌市中央区大通西1丁目14番地2,北海道,01,
6245210666599,http://www.city.ueda.nagano.jp,JP,2000020202037,上田市,ウエダシ,長野県上田市大手1丁目11-16,長野県,20,2023-04-03T08:19:02Z
2277749182839,,JP,6430001028735,株式会社ビートル・イード,ビートルイード,北海道札幌市厚別区厚別南4丁目19番14号,北海道,01,
2675162447317,,JP,5430005001945,医療法人社団中條歯科医院,シャダンチュウジョウシカイイン,北海道札幌市北区新琴似九条11丁目11番15号,北海道,01,
8864161610020,http://shinoro-yamada-dental.com,JP,5430005001648,医療法人社団健生会,ケンセイカイ,北海道札幌市北区篠路六条5丁目158番104号,北海道,01,
4575003891677,,JP,6430005001531,医療法人本間皮ふ科クリニック,ホンマヒフカクリニック,北海道札幌市北区あいの里二条8丁目4番1号,北海道,01,
6262410302803,http://hirakawa-d.or.jp,JP,8430005001645,医療法人社団賢裕会,ケンユウカイ,北海道札幌市北区篠路二条6丁目4番26号,北海道,01,2023-04-03T03:23:24Z
6361902757254,,JP,3430005001947,医療法人社団野村内科医院,ノムラナイカイイン,北海道札幌市白石区北郷二条1丁目2番4号,北海道,01,
3156574777424,,JP,1320001013158,株式会社友輪,ユウワ,大分県別府市大字鶴見1951番地の30,大分県,44,
5339710529407,,JP,7430002010113,有限会社白石調剤薬局,シライシチョウザイヤッキョク,北海道札幌市豊平区平岸四条14丁目2番3号,北海道,01,
6688122241025,http://www.city.semboku.akita.jp,JP,3000020052159,仙北市,センボクシ,秋田県仙北市田沢湖生保内字宮ノ後30,秋田県,05,2023-04-03T05:08:26Z
2348121686989,,JP,8430005010530,医療法人社団凛未燿会,リンミョウカイ,北海道札幌市厚別区青葉町8丁目5番29号,北海道,01,
1921194267467,https://kochi-weeks.co.jp,JP,2490001009163,株式会社WEEKS,ウィークス,高知県高知市南はりまや町1丁目3番7号サンコート南はりまや1階,高知県,39,
1028748246991,http://jkkai.com,JP,8430005001851,医療法人社団慈昂会,シャダンウツミノボルカイ,北海道札幌市豊平区福住二条1丁目2番5号,北海道,01,2023-04-03T03:28:02Z
9188028032126,,JP,,,,,,,
2962567524992,,JP,7430005013988,医療法人社団翠和会,スイワカイ,北海道札幌市白石区南郷通19丁目南3番25号マルシンビル南郷1階,北海道,01,
5253012059861,http://green-chozai.com/,JP,3430001005101,株式会社グリーン調剤,グリーンチョウザイ,北海道札幌市中央区大通西11丁目4番27号,北海道,01,2023-04-03T03:24:41Z
7404100707496,https://ike-fami.or.jp,JP,6430005001622,医療法人社団池田ファミリー歯科,シャダンイケダファミリーシカ,北海道札幌市北区篠路四条8丁目1番18号,北海道,01,
8802189478393,,JP,5430001035740,株式会社久保ファーマシー,クボファーマシー,北海道札幌市北区新琴似十条8丁目2番11号,北海道,01,
1026637632073,http://eveclinic.jp/,JP,4430005012902,医療法人社団EVEウィミンズクリニック,シャダンEVEウィミンズクリニック,北海道札幌市白石区南郷通21丁目南5番41号,北海道,01,
5060984339204,,JP,1430002015514,株式会社バイタル,バイタル,北海道札幌市白石区北郷二条1丁目2番4号,北海道,01,
7730512603348,https://gakken-educational.co.jp/,JP,5010701022774,株式会社学研エデュケーショナル,ガッケンエデュケーショナル,東京都品川区西五反田2丁目11番8号,東京都,13,2023-04-03T16:52:36Z
9277129402795,https://houjin-db.info/companies/1180003023285,JP,1180003023285,合同会社虹色,ニジイロ,愛知県知多市南粕谷1丁目20番地の65,愛知県,23,
7725954650656,,JP,2430005006360,医療法人社団南郷メンタルクリニック,シャダンナンゴウメンタルクリニック,北海道札幌市白石区南郷通19丁目南3番11号メディカル97 4F,北海道,01,
1149942149937,http://www.cruto.net,JP,2330001022636,株式会社Steki,ステッキ,熊本県熊本市東区下江津5丁目10番22号,熊本県,43,
7020973913392,http://www.sato-pediatric-clinic.com,JP,3430005001872,医療法人社団さとう小児科医院,サトウショウニカイイン,北海道札幌市北区北二十五条西5丁目1番1号,北海道,01,2023-04-03T03:34:07Z
4187239357400,,JP,9430002034036,有限会社つかさ,ツカサ,北海道札幌市清田区美しが丘二条3丁目7番2号,北海道,01,
1629750426852,,JP,2430002000283,有限会社アート調剤薬局,アートチョウザイヤッキョク,北海道札幌市北区新琴似八条6丁目5番10号,北海道,01,
4928513060606,http://www.hakusui-kai.jp,JP,6430005003726,医療法人社団白水会,ハクスイカイ,北海道札幌市手稲区西宮の沢一条4丁目10番17号,北海道,01,
8759874917644,https://www.qolhd.co.jp/,JP,6010401088941,クオールホールディングス株式会社,クオールホールディングス,東京都港区虎ノ門4丁目3番1号城山トラストタワー37階,東京都,13,
1695898424933,https://vns-bloom.jimdofree.com/,JP,6180303003569,合同会社SHIARA,シアラ,愛知県豊田市永覚新町3丁目17番地MIガーデン102号室,愛知県,23,
8179295774650,,JP,7350002009667,株式会社MINORI,ミノリ,宮崎県宮崎市佐土原町下田島12133-45,宮崎県,45,
7164753020541,http://oguro-hp.jp,JP,8430005001901,医療法人社団太黒胃腸内科病院,オオグロイチョウナイカビョウイン,北海道札幌市北区北十一条西3丁目1番15号,北海道,01,
5733680186675,http://www.fusegawa-naika.com,JP,4430005001987,医療法人社団布施川内科医院,フセガワナイカイイン,北海道札幌市北区新琴似七条14丁目4番23号,北海道,01,2023-04-03T03:27:06Z
9619745347926,http://www.tenbien.jp/,JP,3170005001981,社会福祉法人中庸会,チュウヨウカイ,和歌山県海南市七山964番地の1,和歌山県,30,
2212161347057,,JP,5430005002010,医療法人社団ふるげん内科・循環器クリニック,フルゲンナイカジュンカンキクリニック,北海道札幌市白石区北郷三条4丁目6番1号,北海道,01,
8832215420961,,JP,9430005004861,医療法人社団慈生会,ジセイカイ,北海道札幌市北区北三十八条西2丁目2番17号,北海道,01,
3332040612375,,JP,5430005001978,医療法人社団箱木歯科,シャダンハコギシカ,北海道札幌市北区篠路三条5丁目1番20号,北海道,01,
1781285453693,http://www.igarashi-c.jp/,JP,2130005009278,医療法人健心会,ケンシンカイ,京都府京田辺市河原神谷7-1,京都府,26,2023-04-03T10:59:42Z
8456265409209,,JP,6080105002374,特定非営利活動法人優輪会,ユウワカイ,静岡県駿東郡清水町徳倉405番地の6,静岡県,22,
1780444203886,http://ph-asami.co.jp/,JP,7430001045291,株式会社あさみ,アサミ,北海道札幌市北区北十三条西4丁目2番16号,北海道,01,
4366404455806,http://shinkawashindo.com,JP,8430005001513,医療法人新川新道整形外科病院,シンカワシンドウセイケイゲカビョウイン,北海道札幌市北区新川五条4丁目2番8号,北海道,01,
1453443526127,http://kai-reha.jp/,JP,2090005006263,医療法人久晴会,キュウセイカイ,山梨県甲斐市西八幡3990番地,山梨県,19,
2673603342751,http://kitasatsu.or.jp/,JP,9430005001677,医療法人社団北札幌病院,キタサッポロビョウイン,北海道札幌市北区新琴似九条1丁目1番1号,北海道,01,
6761098639268,http://www.yahata-hp.com,JP,9011405000063,医療法人社団翠会,ミドリカイ,東京都板橋区三園1丁目19番1号,東京都,13,
1057007060414,http://www.spmed.jp/medimap/detail/?id=676,JP,7430005001877,医療法人社団たちばなこどもクリニツク,タチバナコドモクリニック,北海道札幌市北区屯田四条1丁目7番10号,北海道,01,
6156825090989,http://www.suzuki-hp.or.jp,JP,8320005004452,医療法人久寿会,キュウジュカイ,大分県速見郡日出町大字藤原1691番地の1,大分県,44,
6632791002093,,JP,6430005014665,医療法人和,ワ,北海道札幌市厚別区上野幌三条4丁目19番26号ホクノー上野幌ビル2階,北海道,01,
6077907426373,http://www.hirama-byouin.or.jp/,JP,,,,,,,
2381214173616,,JP,,,,,,,
3614697067547,http://www.corecom.jp/about/,JP,3430001028663,コアファルマ株式会社,コアファルマ,北海道札幌市北区北三十二条西5丁目1番23号ビアンノース1階,北海道,01,
1568104066679,,JP,8430005001703,医療法人社団恒仁会,コウジンカイ,北海道札幌市厚別区もみじ台西6丁目1番7号,北海道,01,
3965377463529,http://www.town.hokkaido-kamikawa.lg.jp,JP,8000020014575,上川町,カミカワチョウ,北海道上川郡上川町南町180,北海道,01,2023-04-03T04:00:55Z